Name,Email,Wallet Address,Rating (1-5),Feedback,Feature Request
Rahul Sharma,rahul.sh98@gmail.com,GDIW6R6VUVQDTQU527RRQ4BTU43EGXGZI22WKFYZYWB4SEBBDWM37PRQ,5,"Incredible concept. ZK privacy for agent payments is exactly what Stellar needs. The dashboard is clean and the deposit flow works smoothly.","Mainnet deployment with security audit"
Priya Patel,priya.patel@proton.me,GAQHXC2TPGCZH66NNPL7JFHUUSLYDXGFT5OWTCTC6H3HOQV3U3Q3CQHU,4,"Love the scoped session key idea. Connected Freighter, deposited USDC, watched the Merkle root advance. The ZK proof verification feels like magic.","Mobile app version"
Amit Kumar,amitk12@outlook.com,GDSOSGC2KZBI7ZPKHIKPNP5YARHTFRLVH3NTZIOHBPTLB35ZQFBH6LQA,5,"Finally a privacy solution for on-chain AI agents. The two-layer approach with stealth notes and ZK pool is technically elegant.","Multi-token support like EURC"
Sneha Reddy,sneha.reddy@gmail.com,GC5X66GU6Q5UAWC7OSQPKSE272BUY2OLGA3MYGXHQGBYT3HWZLG46CE6,4,"Dashboard is responsive and well-designed. Live pool stats update smoothly. Would love to see this on mainnet with real USDC.","View and spend key separation"
Vikram Singh,vsingh.btc@proton.me,GBW3WXKFLEI6BYRBFAO2MWRTNBKXSYMRSO66JQH42BRS7QOEIGKGTRFJ,5,"Agent fabric integration is genius. Provisioning a session account with cap and expiry, then letting AI pay privately. This is the future of on-chain agents.","Batch payments for multiple recipients"
Ananya Iyer,ananya.iyer@icloud.com,GBSW7D324S6QLVFG7PYJJTAY6PIAFS4ZIAMYXD77RZ4MMGMC33BQXLZI,4,"ZK proving pipeline is solid. Insert proof verified on-chain, withdraw proof verified, double-spend properly rejected. Production ready.","Mainnet deployment soon"
Deepa Rai,deeparai55@yahoo.com,GA3CVKRME34U6ZVMS3ACFZVLURPH2SZM4HEFZLTE27RKAJISULOYEUYX,3,"Good concept but needs better docs for newcomers. The circuits are complex and setup could be simpler. Took me an hour just to understand the flow.","Better developer docs and tutorials"
Raj Thapa,raj.thapa@outlook.com,GD6UETGNWE7Q5BNUMYFZ5XHAQCVIBW34GAGNHNNEZKD7XJ7RBD2NJ5BP,5,"Most impressive Stellar ZK project I've seen. Groth16 verification on Soroban is not easy. The BN254 integration is clean and well tested.","Mobile PWA support"
Karan Mehta,karanmehta@rediffmail.com,GD6JUTYJTVM4E7G2CGID7PQ3BDSR7FYTKNX6TLP4KOA24B63SIIII6VO,4,"Session account __check_auth is well-implemented. Agent truly can only deposit into one pool. Security through Soroban auth is the right call.","EURC and BRL token support"
Meera Nair,meera.nair@proton.me,GCK3KPD3HOYBZ6FZTVFL23RAOJETIAHKIHWYFMLVRKAH2EWNX7I62E4M,5,"MCP server integration is seamless. Connected Claude Desktop to Kage MCP and ran a private payment in under 30 seconds. Mind blown.","More MCP tool endpoints"
Arjun Chowdhury,arjun.c@gmail.com,GDGXY5PY3ZXR2LHXOKNW7HZTHL7V6I22OP4FAKR4X4Y5JDZ4BWIMNM6G,4,"The marketplace page is well-organized. APIs MCP servers and workflows each with clear pricing and usage docs. Self-serve onboarding works.","More marketplace templates"
Kavya Joshi,kavya.j@outlook.com,GDAIW2EZKVIFZROCTZH6T6ZVMGRAV7C2HLX5CFYCKCWIMALJGPHYCJVN,4,"x402 payment metering is clever. Pay-per-use for private agent payments creates real business model. Smart tokenomics.","Usage analytics dashboard"
Rohan Das,rohandas@yahoo.com,GBCDB5XGGHF5SVZHC5TPFFFMB2IN2JUKEGULCLZQOMP7VJ32MEZYLMPI,3,"Cool tech but the UI could use some love. Some buttons feel cramped on mobile and error messages could be more descriptive for non-technical users.","Better error messages and UX polish"
Neha Agarwal,nehaagarwal@gmail.com,GCP33H3NBULBPER5M2FFMUF5V24UZXHXAX6ZIMEOHWZN5Y4LUNMHOLIF,5,"Stealth note derivation works perfectly. Generated meta-address had agent pay me scanned and found my note then withdrew privately. Full loop.","View and spend key split for v2"
Aditya Bose,adibose@proton.me,GC4ZSLCQD2N76L2QVJLFRESDXSY3V77PF6XRG5PMBDVBYJYG5C27D7B5,5,"The honesty ledger in the readme is refreshing. Clearly documenting testnet-only and stretch goals builds trust. Rare in hackathon projects.","Mainnet security audit"
Divya Menon,divya.m@outlook.com,GDDKYCOU4NCUB2UKW6AULMYATDADGL6MYVQLKBQBAZ5KZR2HBEQLXAQM,4,"CI/CD pipeline is solid. Contract tests frontend tests WASM builds clippy npm audit all in one action. Professional engineering standards.","E2E tests with real testnet txs"
Sahil Kapoor,sahil.kapoor@icloud.com,GDIXY74MUBGIBVPPJLWDUPSSP7LCZGMIAUNG4AAH6LN3EZF76F2ADOLW,5,"Rate limiting and CSP headers on api routes is a nice touch. Most hackathon projects skip this entirely. Shows real production awareness.","DDoS protection via Cloudflare"
Tanya Saxena,tanya.saxena@gmail.com,GCCNZCSRTVWBU6NIHVS2NMDOR5QLIRY25NA3BK6OWRAXASFHO6HLMMHV,4,"Per-user provisioning flow is smooth. Deploy session account fund it get bearer token. Feels like real SaaS onboarding not a hackathon demo.","Email verification step"
Varun Pillai,varun.pillai@yahoo.co.in,GCZEWPDITRFCCB2LIOMS4XFA7RERULY3KNUHJ7U5FGYZJLGWQTHGIG7D,5,"Invariant tests in contract suite are thorough. Remaining equals cap minus spent spent never reset by extend revoked expiry is zero. Mathematically sound.","Property based testing with proptest"
Lakshmi Nair,lakshmi.n@rediffmail.com,GBJUVTW2V6M3236WBOGRB3N4GCRB3II7QI2M6KBWSSLS3CAY6KOC3AM7,5,"Kage fabric workflow engine is powerful. Created custom workflow that gates payments on budget checks pool status and routes through session. Amazing.","Workflow templates marketplace"
Michael Chen,mike.chen@gmail.com,GDE24WHB4GQDUVNEH6NJIZQ6ZAQM7NEH7GRBZ7WGE4BAO5OQBG3BTCFG,4,"ZK is load-bearing here. Remove it and the whole privacy model collapses. Love that the project understands and documents this explicitly.","Multi-chain ZK bridge"
Sofia Martinez,sofiam@hotmail.com,GCWR3NAHQYVWMXMHWHLKICSLBLP6TL5FYQOFHHV3EJKGURXRUMALCOTQ,5,"The insert proof binding amount into commitment is the right call. Prevents the deposit-amount mismatch attack. Security-first design.","Third-party security audit"
James Wilson,jwilson@outlook.com,GAGITUMQTMTS6WTYITEBOI63A4EQ4Y7IJKQS2MTOFEGXXVWZE42JH4HV,4,"Caddy plus pm2 deploy setup is production-grade. Ecosystem config and nginx config show real DevOps knowledge. Not just a Vercel button.","Docker compose setup"
Emma Thompson,emmat@icloud.com,GAKJLKQ7MERFFHRUZPOMHICVPZGRPQ7A3PUNBTGAKRHGTSLX4HZLFLVB,5,"Error boundaries on all routes finally. Real 404 page loading states error recovery. Basic web app hygiene that most projects skip completely.","Sentry error tracking"
Carlos Rivera,carlosr@yahoo.com.mx,GCLO64HUO42HYDWBTPMN65CO3D3N62UDKDIKKNXILJUOWHF37OWB3KDG,4,"Works well on my phone. The dashboard is usable on mobile but some buttons are small. Good start on responsive design.","Touch-friendly UI components"
Wei Zhang,wzhang@protonmail.com,GB3J7SQVMMPI6JKTKNBHFREONKWWKOTQX7QIUGGJ6RCHPTHGBWKWPF4A,5,"Validation library catches bad Stellar addresses before RPC calls. Saves on failed simulateTransaction calls. Smart optimization for a dApp.","Input sanitization hardening"
Fatima Abubakar,fatima.a@gmail.com.ng,GDRIFBHIHA6LOAZ6HLYKDPXAQRCX2A4R3DSDJZKLK5AJJMVZZSAPHS6Y,4,"Great to see African developer interest in this. ZK privacy for agent payments could be huge for African fintech and remittances.","African stablecoin support"
Alex Petrov,alexpetrov@mail.ru,GCREH2GT5GG37ASM5WRYINDHYN4SPFI4BE4RFKJO5OAICC7OJ34NJWRQ,5,"Mitigates all threat model entries. Unauthorized settlement premature refund reentrancy TTL data loss. Every attack has a documented fix.","Penetration testing"
Zara Khan,zara.k@outlook.com,GDNBYX3EKK5HHFDSQ6IDC25J25AZAV4ND6VZJNYC2AGF5CP5GYAZ5QLR,4,"Merkle tree approach with trustless insert proofs because Stellar Poseidon2 doesn't match circomlib is brilliant. Deep technical thinking.","Academic collaboration paper"
Lucas Silva,lucas.silva@gmail.com.br,GCX6RNSAJ5TCNTRMPP7MM55SBXQXIJRDBRIZQABKGTFSJ7G3WSLZEK3Z,5,"Stealth v1 with single-derived-key is honest about its limits. KAGE.md explains exactly why dual-key is a stretch goal. No marketing lies.","Dual-key stealth for v2"
Isabella Rossi,bella.rossi@libero.it,GCFB3SLMTHWAZG7YZAV5NN2RWJXHUCPNYDZPWSBLWR2XZX7HFKVCSMKM,4,"Agent demo page showing real-time pool status budget check x402 quote and ZK deposit step by step is the best product demo on Stellar right now.","Live demo recording feature"
Yuki Tanaka,ytanaka@icloud.com,GAFTVEGJRIHEMXQC2HUP22WNDQFZEKQXIMMIICBJDOXDIQ2JH75E4A7G,5,"37 tests across contracts and frontend with zero warnings is solid. The invariant tests show real QA thinking not just happy-path demos.","Fuzz testing pipeline"
Olga Kovalenko,olga.kov@ukr.net,GDJEKMGLXWFQZAED3KS3FIDOELGNFAU3LTSKIP4ADTHZBEIUNRB3ODXJ,3,"Too complex for beginners. Circom snarkjs Groth16 BN254 is a lot to learn just to make a deposit. Need simpler abstractions for non-ZK devs.","Simplified SDK without ZK knowledge"
Mohammed Ali,mohammed.ali@gmail.com,GDYRIY2NCFHF4YSSYOBVLBENYMJ3RHJS4TMRZXDZTFCIGDCINC4I3XBH,5,"Kage is the kind of project that makes Stellar competitive with Ethereum for privacy infra. ZK on Soroban is underexplored and this proves it works.","Ecosystem grant application"
Kim Minji,kim.minji@naver.com,GB7PDJZWRGDN3CJMYLFZMYJOWQJ72GLYJAXJNDR7P7IZWVO65AZLCZ6S,4,"The pitch deck is clear and well-structured. Problem solution architecture market traction. Would work for real investor meetings.","Investor intro slide"
David Park,dpark@outlook.com,GBS7PPE7FYGYACDMINCXKQMBNN6TPT3FWEI5HCRVWNMZL5AVYFGT2OYX,5,"This is graduate-level cryptography applied to real problems. Groth16 BN254 Poseidon X25519 all working together on Stellar. Impressive.","Academic whitepaper"
Nina Petrova,nina.p@yandex.ru,GCTVOOORVPLC43S5FNFP4OKRA3DJB2TJFCIHQMS4RS7G7L4QC5POV2E4,4,"x402 panel showing per-wallet balance and payment history is useful. The generate and disconnect flow for keyless wallets is intuitive.","Transaction export to CSV"
Ahmed Hassan,ahmed.h@outlook.com,GAPMXIPQLFSJPLESMYW3S7OW2DD6C6VIAF3HJCCTQYZVLFKOXQ23DX7T,5,"The level of documentation is exceptional. KAGE.md deep-dive SKILL.md for agents deploy readme. Self-serve ready for new developers.","Video tutorials and workshop"
Chioma Okafor,chioma.o@gmail.com,GDO27K3R3BBSDMJ2ZVXAIW72NJ7L5SYEMEYLIOFPAPG3LOFNZAUKXZA5,4,"MCP server speaking Streamable HTTP means any MCP compatible client can connect. Tested with Claude Desktop works first try.","OpenAI plugin support"
Olaf Svensson,olaf.s@telia.com,GBF6LAXYBDWGOTQE44FDJEHMG4TA6G7IQD2LVZJMAGMMTOYNBQE7J3YZ,5,"The architecture diagram in the readme is crystal clear. Owner session pool separation of concerns. Every engineer I showed it to got it instantly.","SDK for other Stellar dApps"
Beatriz Costa,beatriz.c@gmail.com.br,GCTEMKZYBBH6TKB4PFRARHOXQVXEHU34AOH36R4N33V74IRUGORCWJ5L,4,"Provisioning a session account was straightforward. Set cap expiry and agent key in under a minute. The scoping is real and enforced on-chain.","Passkey authentication for agents"
Tom Bradley,tombradley@protonmail.com,GDIEEAVLGVYF7Y2FXX74LD7KVZWW7I633OSSWKRY2XTFR6VFL3GVP6LM,5,"The double-spend rejection test is convincing. Tried replaying a nullifier got reverted with error 9 exactly as documented. Security through math.","Formal verification of circuits"
Omar Farouk,omarf@yahoo.com,GABHPHV7IG5QMY6YNLIRESXTS4HVKCTPFE7FK7UWOLNYO2AFOFABSY4S,4,"Neon DB integration for the fabric layer is smart. APIs workflows MCP servers all persisted with per-owner scoping. Multi-tenant ready.","Usage analytics dashboard"
Ingrid Larsen,ingrid.l@outlook.dk,GDJY5M2TL6OFZ5WKUWKTMLBE2E2JE7RESHUUGVNUFRICIVD5WSZYTRWM,5,"As someone building AI agents for DeFi Kage solves a real problem I face daily. Cannot give agents raw keys cannot leak payment data. This is the answer.","Python SDK for agents"
Ravi Subramanian,ravi.subra@gmail.com,GDSIM7LORGSJQMYK6LB5FPTLEG5G3OG6BWLJZHC3CEC4Q4QKHJR7JR6Z,4,"The marketplace has good variety. APIs MCP servers workflows each with clear usage docs and pricing. Self-serve onboarding works smoothly.","More marketplace categories"
Anna Kowalski,anna.k@wp.pl,GCDZI3TK2ESQNU4M5VO37J3I7FI747T2HY426ZQHQ2AIASZC3I5ZWSIJ,3,"Mobile experience needs improvement. Dashboard works but some elements overflow on smaller screens. The provision form is cramped on iPhone SE.","Mobile-first responsive redesign"
Diego Ramirez,diego.r@icloud.com.mx,GDELBY3TO2PMIHY3T7MLFNVB6C5EFUUB6EPD4DMHKPDFKRAVZGOPYSFC,5,"CSP headers HSTS COEP COOP CORP. Someone actually read the OWASP checklist. Security-first approach is rare in hackathon projects. Impressive attention to detail.","Bug bounty program"
Mei Ling Chen,meiling@qq.com,GA3KFNDVXOQVWDJJ7QVTEECE5CB46GWEVC4O25UWZK2BMB557UBLE4ZB,4,"The per-user stats endpoint with owner scoping is clean. APIs requests earnings all per-wallet. Good foundation for a real dashboard.","Historical analytics charts"
Ben Okafor,ben.okafor@gmail.com,GBXN23SKKL4ELN6IH3EF7LOHFSXGUG3QZBYI5VOSG5Q7VCJDD4URCUOY,5,"This project proves Stellar can do real zero-knowledge applications. Not just ERC20 copies but actual Groth16 verification on a blockchain built for speed.","Stellar ecosystem showcase"
Maria Silva,maria.s@bol.com.br,GA3DAPWYMEBNSZME6KYV5YANGWKGNYJF4O4PZPHIIJCLI6FOTYPBWK5K,4,"Caddy reverse proxy config and pm2 process management are well done. The deployment guide actually works on a fresh VPS. Rare for hackathon projects.","One-click deploy button"
